{
  "$schema": "https://json-schema.org/draft/2020-12/schema",
  "$id": "claim.schema.json",
  "title": "FinRobot Claim",
  "description": "A single financial claim extracted from a FinRobot equity research report.",
  "type": "object",
  "required": ["claim_text", "claim_type", "metric", "unit", "source_status", "confidence", "extraction_method", "ticker"],
  "properties": {
    "claim_text": {
      "type": "string",
      "description": "120-char context window around the matched value. Not a full sentence — a window of surrounding text.",
      "maxLength": 300
    },
    "claim_type": {
      "type": "string",
      "enum": ["financial", "valuation", "stock-price", "guidance", "peer-comparison", "catalyst", "risk", "narrative"],
      "description": "Category of the claim. 'guidance' and 'peer-comparison' are always not_machine_verifiable."
    },
    "metric": {
      "type": "string",
      "description": "Financial metric type.",
      "enum": [
        "revenue", "ebitda", "eps", "pe_ratio", "ev_ebitda",
        "revenue_growth", "ebitda_margin", "gross_margin", "net_margin",
        "net_income", "free_cash_flow", "market_cap", "total_debt",
        "financial_figure", "growth_rate", "price_target", "return"
      ]
    },
    "period": {
      "type": ["string", "null"],
      "description": "Fiscal year string (e.g. '2023') or null. WARNING: may be wrong due to _nearest_year() ±200 char heuristic in multi-year sentences. Treat as approximate.",
      "pattern": "^(20[0-9]{2}|Q[1-4] 20[0-9]{2}|[0-9]{4}[EAe]?)$"
    },
    "value": {
      "type": ["number", "null"],
      "description": "Normalized numeric value. USD: raw dollars (not billions). Percent: raw number (16.5 for 16.5%). Multiple: raw float (37.7 for 37.7x)."
    },
    "value_display": {
      "type": "string",
      "description": "Human-readable value as it appears in the report text, e.g. '$60.9 billion', '37.7x', '16.5%'."
    },
    "unit": {
      "type": "string",
      "enum": ["USD", "percent", "multiple", "shares"]
    },
    "source_status": {
      "type": "string",
      "enum": ["unverified", "verified", "incorrect", "unsupported", "not_machine_verifiable"],
      "description": "Always 'unverified' at extraction time. Updated in fact_table_builder."
    },
    "confidence": {
      "type": "string",
      "enum": ["high", "medium", "low"],
      "description": "Extraction confidence. LLM assigns per-claim; regex defaults to 'medium'."
    },
    "extraction_method": {
      "type": "string",
      "enum": ["regex", "llm", "table_parser"]
    },
    "ticker": {
      "type": "string",
      "description": "Uppercase ticker symbol, e.g. 'NVDA'.",
      "pattern": "^[A-Z]{1,5}$"
    },
    "prompt_version": {
      "type": "string",
      "description": "Prompt file used for LLM extraction, e.g. 'claim_extractor_v1'. Only present for extraction_method=llm.",
      "examples": ["claim_extractor_v1"]
    },
    "prompt_hash": {
      "type": "string",
      "description": "SHA-256 of the prompt file at time of extraction. For reproducibility auditing.",
      "pattern": "^sha256:[a-f0-9]{64}$"
    },
    "model_name": {
      "type": "string",
      "description": "Model used for LLM extraction, e.g. 'claude-sonnet-4-6'. Only for extraction_method=llm."
    },
    "provider": {
      "type": "string",
      "enum": ["anthropic", "ollama_fallback"],
      "description": "LLM provider. 'ollama_fallback' results should not be aggregated with 'anthropic' results."
    },
    "input_hash": {
      "type": "string",
      "description": "SHA-256 of the input sent to the LLM (truncated report text).",
      "pattern": "^sha256:[a-f0-9]{64}$"
    },
    "output_hash": {
      "type": "string",
      "description": "SHA-256 of the raw LLM response before JSON parsing.",
      "pattern": "^sha256:[a-f0-9]{64}$"
    }
  },
  "additionalProperties": false
}
